男性,29,JPOP(バラード寄り).邦ロックなど,4,10,週数回,常に,親,,GLAY 小田和正 サザンオールスターズ ドリカム,はい,5,5,5.0,5.0,ややある,ときどき,テレビ,車内の方が記憶に残っている,ALI PROJECT、SoundHorizon、宇多田ヒカル,夏に母がリピートでかけていたGLAYのHoweverを聴きながら、Tシャツの袖の中にクーラーの空気を送って涼んでいたのをよく覚えてます。,だいぶあると思います。子どもが初めて質の良いスピーカーで立体的な音を聞くのは大抵車だと思うので。
女性,22,ボーカロイド、オルタナティブ、インディーズ,4,16,週数回,常に,親,,[ALEXANDROS]、安室奈美恵、King Gnu,はい,4,4,3.0,3.0,あまりない,はい,テレビ,車内の方が記憶に残っている,,,
女性,32,邦楽ロック,4,10,週数回,よく,親,,宇多田ヒカル,なんとなく,2,4,4.0,1.0,あまりない,ない,テレビ,車内の方が記憶に残っている,,ピアノで習ってた曲,
男性,31,J-POP、ロック,5,12,週数回,常に,親,,"BACKSTREET BOYS, ENYA, DEEP PURPLE, The Beatles, 嘉門達夫, 太田裕美",なんとなく,3,4,4.0,5.0,ややある,ときどき,テレビ,車内の方が記憶に残っている,"サザンオールスターズ, 中島みゆき",車内で流れていた嘉門達夫の曲でよく笑っていたが、学校の友達には通じることがなく、「これ我が家でしか流行ってないんじゃないか」と薄々気付き始めたこと。,あるあるだと思います！親の車で流れていた曲そのものを聴き続けるというよりは、趣味嗜好に関する初期設定が完了してしまうイメージです。自分の場合は楽しいドライブのときに聴いていた音楽にポップスが多かったので、今でもポップスを好んで聴くようになったと思っています。一方で休みの日に遊びたいのに父親が家でプログレとかメタルの番組を観ていたことはあまり良い印象が無いのでそっちの嗜好には走らなかったのかなと。もちろん本人の人生で何を選んでいくかは自由意志で決められますが、幼少期にある程度の方向性が決められるという意味では決定論的な要素も少なからずあると思います。
男性,38,Jpop JRock classic,4,12,週数回,常に,"親, 自分",,"チェリッシュベスト、今井美樹""PRIDE""、酒井法子""碧いうさぎ'' ""鏡のドレス"" ""涙色""、山口百恵ベスト、大黒摩季""熱くなれ"" ""ららら""、宇多田ヒカルアルバム""FirstLove""、小松未歩""謎""",はい,5,4,4.0,4.0,とてもある,はい,テレビ,車内の方が記憶に残っている,GLAY、L'Arc-en-Ciel、XJAPAN,家族で夜ドライブすることが多かったので曲を聴くとその時の記憶がよみがえる,いい意味でも悪い意味でも影響は多分にあると思う
男性,36,ファンク、R&B,5,13,週数回,常に,親,,久保田利伸、宇多田ヒカル、MISIA,はい,3,5,5.0,5.0,ややある,はい,テレビ,車内の方が記憶に残っている,ポルノグラフィティ、B'z,シートを倒した状態で眺めている流れる街灯,自分の音楽のルーツだと思います。
男性,29,ボーカロイド、サントラ、ユーロビート,5,13,週数回,常に,親,,佐野元春 someday,はい,3,4,3.0,4.0,ややある,ときどき,ラジオ,どちらも同じくらい記憶に残っている,ユーロビート,父親が上機嫌に口ずさんでた,あると思います。少なからず影響を受けると思います
男性,37,ゲーム音楽、アニソン,2,15,週数回,たまに,親,,サザンオールスターズ「SAUDADE ～真冬の蜃気楼～」,なんとなく,4,4,4.0,4.0,ややある,ときどき,自分以外の家族の部屋,どちらも同じくらい記憶に残っている,井上陽水（父の趣味）　平井堅（母の趣味）　ポケモンのアニメの曲　みんなのうた色々（自分でカセットを操作して聴いていました）,小学校中学年頃、母方の祖父の死や父母の不仲などから「真冬の蜃気楼」の「国際電話が最後のお別れ」「冷たい膝を抱き寄せた」など死のイメージ、「人はどうして過去への扉を叩いて生きるの」など後悔のイメージの印象が強く、これを流している母の想いが含まれているように感じていました（実際にはわかりません。単に好きな曲だったのかも）,幼少期といえども、小学生は死を認識する程度の人格は育ってきているので、卵が先か鶏が先か的なところは出てきてしまう気がします（すでに死や人生の不条理を気にする人格だったので、音楽のそういう印象が記憶に残ったのか、音楽のそういう印象がもとでそういう人格が強化されたのか）
男性,40,邦ロック、邦パンク、JPOP、洋楽もたまに。,5,14,週数回,よく,"親, 自分",,聖闘士星矢のOP,いいえ,4,3,3.0,2.0,あまりない,ない,テレビ,あまり印象に残ってない,覚えていない,,あまり相関性はないんじゃないかと思われます。
男性,30,女性アイドル(J・K共に),3,13,月数回,常に,親,,SMAP、中谷美紀、小田和正、中島美嘉、清春、ミスチル,いいえ,4,3,5.0,4.0,ややある,ない,テレビ,車内の方が記憶に残っている,浜崎あゆみ、鈴木亜美、モーニング娘。、ケミストリー,,
男性,55,ハードロック、グラムロック,5,13,週数回,たまに,親,,森田公一とトップギャラン,なんとなく,4,3,3.0,3.0,ややある,はい,テレビ,その他の場所の方が記憶に残っている,中森明菜,私の幼少期は、8トラックが主流でした,自分の子は好みが違うので、あまり理解できないかなぁ…
女性,39,ロック、メタル、テクノ、プログレ,5,14,月数回,よく,親,,,なんとなく,3,2,2.0,1.0,あまりない,ない,自分以外の家族の部屋,その他の場所の方が記憶に残っている,葉加瀬太郎,曲は覚えていないけど、親が流れる曲で鼻歌を歌っていたのは覚えてます。,興味深い視点だと思います。
女性,45,"JPOP,アニメソング",5,13,毎日,常に,"親, 自分",,"演歌（親の趣味）, 当時の流行歌（親の趣味）,アニメソング（自分の趣味）",はい,3,5,3.0,3.0,とてもある,はい,テレビ,車内の方が記憶に残っている,,,考えた事がない
